{
  "$schema": "https://json-schema.org/draft/2020-12/schema",
  "$id": "reference_factory.video_analysis.v1",
  "title": "Reference Factory Video Analysis",
  "type": "object",
  "required": ["schema", "id", "referenceId", "provider", "status", "media", "signals", "patternCard"],
  "properties": {
    "schema": { "const": "reference_factory.video_analysis.v1" },
    "id": { "type": "string" },
    "referenceId": { "type": "string" },
    "provider": { "type": "string" },
    "status": { "type": "string" },
    "media": { "type": "object" },
    "signals": { "type": "object" },
    "patternCard": { "$ref": "pattern_card.v1.schema.json" },
    "raw": { "type": "object" }
  }
}
