{
  "schema": "reference_factory.video_analysis.v1",
  "id": "analysis_ref_001_local",
  "referenceId": "ref_001",
  "provider": "local",
  "status": "pattern_ready",
  "media": {
    "durationSeconds": 7.5,
    "width": 1080,
    "height": 1920,
    "hasAudio": true
  },
  "signals": {
    "frameSamples": [],
    "sceneCuts": [0.0, 3.2],
    "motion": { "energy": "medium" },
    "ocrText": "example hook"
  },
  "patternCard": {
    "schema": "reference_factory.pattern_card.v1",
    "id": "pattern_mirror_001",
    "platform": "instagram",
    "source": { "referenceId": "ref_001" },
    "formatType": "mirror_selfie",
    "hookType": "pov",
    "visualPattern": "Phone-native mirror selfie with short overlay.",
    "shotSequence": ["medium mirror selfie"],
    "cameraStyle": { "framing": "vertical 9:16" },
    "subjectAction": "confident mirror pose",
    "textOverlayStyle": { "placement": "lower third" },
    "pacing": { "energy": "medium" },
    "audioVibe": { "energy": "medium" },
    "reuseRisk": "medium",
    "copyRiskNotes": ["Do not copy identity."],
    "transformationInstructions": ["Change scene details."]
  },
  "raw": {}
}
